{
  "id": "user",
  "type":"object",
  "$schema": "http://json-schema.org/draft-04/schema",
  "required": [
    "password",
    "email"
  ],
  "additionalProperties": false,
  "properties":{
    "admin": {
      "type": "boolean",
      "default": false
    },
    "created": {
      "type": "string"
    },
    "email": {
      "type": "string"
    },
    "id": {
      "type":"string"
    },
    "name": {
      "type": "string",
      "default": ""
    },
    "password": {
      "type": "string"
    },
    "recovery_token": {
      "type": ["null","string"],
      "default": null
    },
    "updated": {
      "type": "string"
    }
  }
}
